{
    "serverName": "My Discord Server",
    "roles": [
        {
            "name": "Scad",
            "permissions": [
                {
                    "permissionName": "Administrator",
                    "allow": true
                }
            ],
            "settings": {
                "color": "#FFFFFF",
                "displaySeparate": true,
                "mention": true
            }
        },
        {
            "name": "Dumbhead",
            "permissions": [
                {
                    "permissionName": "Create Instant Invite",
                    "allow": false
                }
            ],
            "settings": {
                "color": "#000000",
                "displaySeparate": true,
                "mention": true
            }
        }
    ],
    "textChannels": [
        {
            "name": "Test1",
            "permissions": [
                {
                    "roleName": "Scad",
                    "permissions": [
                        {
                            "permissionName": "Manage Channel",
                            "allow": true
                        }
                    ]
                },
                {
                    "roleName": "Dumbhead",
                    "permissions": [
                        {
                            "permissionName": "Send Messages",
                            "allow": false
                        }
                    ]
                }
            ]
        }
    ],
    "voiceChannels": []
}